"lemmatizedAbstract","abstract","source"
"objective: Fibromyalgia ( FM ) be a central nervous system disorder characterize by widespread mechanical hyperalgesia due to unknown mechanism. Several inflammatory mediator, such as interleukin - 1 ( IL - 1 ), IL - 6, IL - 8, and tumor necrosis factor, be increase in the serum of FM patient. Although medication include pregabalin, duloxetine, and milnacipran be use to treat FM, the result be unsatisfying. In the present study we assess whether electroacupuncture ( EA ) can reduce chronic FM pain and then propose a underlie mechanism for this effect. material and method: Chronic FM pain be induce in mouse by dual acid saline injection last up to 4 week. result: Chronic FM pain be treat by EA manipulation, but not in the sham operate group. phosphorylate phosphatidylinositol 3 - kinase ( pPI3K ), protein kinase B, mechanistic target of rapamycin, and nuclear factor kappa - light - chain - enhancer of activate B cell be unaltered in the mouse dorsal root ganglion ( DRG ) and spinal cord ( SC ) after induce FM and administer EA treatment. The pPI3K - associate nociceptive signal pathway be increase in the thalamus of FM mouse, but reverse by EA. Similar result be observe in the mouse somatosensory cortex. Conclusion: this datum suggest that EA have a significant effect on a signal pathway in brain area of FM mouse. this finding suggest the value of EA for clinical practice. keyword: 3 - kinase; Dorsal root ganglion; Electroacupuncture; Fibromyalgia; Phosphatidylinositol; Somatosensory cortex; Thalamus","Objectives:

Fibromyalgia (FM) is a central nervous system disorder characterized by widespread mechanical hyperalgesia due to unknown mechanisms. Several inflammatory mediators, such as interleukin-1 (IL-1), IL-6, IL-8, and tumor necrosis factor, are increased in the serum of FM patients. Although medications including pregabalin, duloxetine, and milnacipran are used to treat FM, the results are unsatisfying. In the present study we assessed whether electroacupuncture (EA) can reduce chronic FM pain and then proposed an underlying mechanism for this effect.
Materials and Methods:

Chronic FM pain was induced in mice by dual acid saline injection lasting up to 4 weeks.
Results:

Chronic FM pain was treated by EA manipulation, but not in the sham operated group. Phosphorylated phosphatidylinositol 3-kinase (pPI3K), protein kinase B, mechanistic target of rapamycin, and nuclear factor kappa-light-chain-enhancer of activated B cells were unaltered in the mouse dorsal root ganglion (DRG) and spinal cord (SC) after inducing FM and administering EA treatment. The pPI3K-associated nociceptive signaling pathway was increased in the thalamus of FM mice, but reversed by EA. Similar results were observed in the mouse somatosensory cortex.
Conclusion:

These data suggest that EA has a significant effect on a signaling pathway in brain areas of FM mice. These findings suggest the value of EA for clinical practice.
KEYWORDS:

3-kinase; Dorsal root ganglion; Electroacupuncture; Fibromyalgia; Phosphatidylinositol; Somatosensory cortex; Thalamus","PubMed"
"objective: Fibromyalgia be a complex, debilitate, multifactorial condition that can be difficult to manage. recommend treatment be usually deliver in outpatient setting; evidence suggest that significant inpatient care occur. We describe the scale and cost of inpatient care with a primary diagnostic code of fibromyalgia within the English National Health Service. method: We conduct a cohort - level observational study of all patient admit to hospital due to a diagnosis of fibromyalgia, between 1 April 2014 and 31 March 2018 inclusive, in the National Health Service in England. We use datum from Hospital Episode statistic admit Patient Care to study: the age and sex of patient admit, numb and cost of admission, length of stay, procedure undertake, class and type of admission, and distribution of admission across clinical commission group. result: A total of 24 295 inpatient admission, cost œ20 220 576, occur during the 4 - year study period. much patient be woman ( 89 % ) with peak age of admission of between 45 and 55 year. much admission be elective ( 92 % ). A numb of invasive therapeutic procedure take place, include a continuous i. v. infusion ( 35 % ). There be mark geographical variation in the prevalence and cost of inpatient fibromyalgia care deliver across the country, even after account for clinical commission group size. conclusion: Many patient be admit for treatment of their fibromyalgia and give invasive procedure for which there be weak evidence, with significant variation in practice and cost across the country. This highlight the need to identify area of resource use that can be rationalize and divert to provide much effective, evidence - base treatment.","OBJECTIVES:

Fibromyalgia is a complex, debilitating, multifactorial condition that can be difficult to manage. Recommended treatments are usually delivered in outpatient settings; evidence suggests that significant inpatient care occurs. We describe the scale and cost of inpatient care with a primary diagnostic code of fibromyalgia within the English National Health Service.
METHODS:

We conducted a cohort-level observational study of all patients admitted to hospital due to a diagnosis of fibromyalgia, between 1 April 2014 and 31 March 2018 inclusive, in the National Health Service in England. We used data from Hospital Episode Statistics Admitted Patient Care to study: the age and sex of patients admitted, number and costs of admissions, length of stay, procedures undertaken, class and type of admission, and distribution of admissions across clinical commissioning groups.
RESULTS:

A total of 24 295 inpatient admissions, costing œ20 220 576, occurred during the 4-year study period. Most patients were women (89%) with peak age of admission of between 45 and 55 years. Most admissions were elective (92%). A number of invasive therapeutic procedures took place, including a continuous i.v. infusion (35%). There was marked geographical variation in the prevalence and cost of inpatient fibromyalgia care delivered across the country, even after accounting for clinical commissioning group size.
CONCLUSIONS:

Many patients are admitted for treatment of their fibromyalgia and given invasive procedures for which there is weak evidence, with significant variation in practice and cost across the country. This highlights the need to identify areas of resource use that can be rationalized and diverted to provide more effective, evidence-based treatment.","PubMed"
"objective: Fibromyalgia ( FM ) be a chronic painful condition partly due to alteration in pain modulation by the central nervous system. Multicomponent therapy ( MT ) and repetitive transcranial magnetic stimulation ( rTMS ) have both be report as pain modulator in FM patient. The aim of this study be to compare the effect of rTMS on pain with a combination of MT and rTMS versus MT. method: Thirty - nine FM patient with pain visual analogue scale ( pVAS ) ò 40mm be randomize to active or sham rTMS ( high frequency, primary motor cortex M1 ) plus 12 week of MT ( 3 session per week combine aerobic train, pool base exercise and relaxation ). rTMS be start 2 week prior MT and maintain until the end of the program ( week 14 ). assessment be achieve at baseline, at week 14, and 6 month ( week 40 ) after complete the program. The main outcome be the pain reduction, assess by the weekly mean daily self - report level of pain. Secondary outcome be cardiorespiratory fitness ( grade maximal exercise test ), cardiac autonomic adaptation and fibromyalgia impact ( fibromyalgia impact, depression, sleep efficiency and pain catastrophizing scale ). result: The reduction of the weekly mean daily pain do not differ significantly between group ( repeat measure of ANOVA ). Two - way ANOVAs show that pVAS, as good as cardiorespiratory fitness, quality of life, depression and catastrophizing, improve significantly at week 14 and remain stable until week 40. Neither Cardiac autonomic adaptation nor sleep efficiency change significantly. CONCLUSION: rTMS do not reduce pain in FM patient who follow the MT program.","OBJECTIVES:

Fibromyalgia (FM) is a chronic painful condition partly due to alterations in pain modulation by the central nervous system. Multicomponent therapy (MT) and repetitive transcranial magnetic stimulation (rTMS) had both been reported as pain modulators in FM patients. The aim of this study was to compare the effects of rTMS on pain with a combination of MT and rTMS versus MT.
METHODS:

Thirty-nine FM patients with pain visual analogue scale (pVAS) ò 40mm were randomized to active or sham rTMS (high frequency, primary motor cortex M1) plus 12 weeks of MT (3 sessions per week combining aerobic training, pool based exercises and relaxation). rTMS was started 2 weeks prior MT and maintained until the end of the program (week 14). Assessments were achieved at baseline, at week 14, and 6 months (week 40) after completing the program. The main outcome was the pain reduction, assessed by the weekly mean daily self-reported level of pain. Secondary outcomes were cardiorespiratory fitness (graded maximal exercise test), cardiac autonomic adaptations and fibromyalgia impact (fibromyalgia impact, depression, sleep efficiency and pain catastrophizing scales).
RESULTS:

The reduction of the weekly mean daily pain did not differ significantly between groups (repeated measures of ANOVA). Two-way ANOVAs showed that pVAS, as well as cardiorespiratory fitness, quality of life, depression and catastrophizing, improved significantly at week 14 and remained stable until week 40. Neither Cardiac autonomic adaptations nor sleep efficiency changed significantly.
CONCLUSION:

rTMS did not reduce pain in FM patients who followed the MT program.","PubMed"
"The pathogenesis of fibromyalgia be still unknown. Core symptom include pain, depression and sleep disturbance with high comorbidity, suggest alteration in the monoaminergic system as a common origin of this disease. The reserpine - induce myalgia model ( RIM ) lower pain threshold and produce depressive - like symptom. The present work aim to evaluate temporal dynamic in the oscillatory profile and motor activity during sleep in this model and to evaluate if the model mimic the sleep disorder that occur in fibromyalgia patient. Hippocampal and EMG activity be record in chronically implant rat. follow 3? day of basal recording, reserpine be administer on 3 consecutive day to achieve the RIM. Post - reserpine recording be take on alternate day for 21? day. Reserpine induce change in the sleep architecture with much transition between state, and a different pattern between the administration period and post - reserpine week. Administration day be characterize by a large amount of REM sleep with dominant theta wave without atonia. follow the reserpinization, theta oscillation be always much fragment and with low frequency. On the post - reserpine day, sleep be dominate by slow - wave sleep with fast intrusion and reduce hierarchical couple with spindle and ripple. Simultaneous electromyography recording also show muscle twitch during sleep and the dissociation of theta activity and muscle atonia. Abnormally high slow wave, alpha / delta intrusion, frequent transition and muscle twitch be common trait in fibromyalgia. Therefore, our analysis support the validity of the reserpine - induce myalgia model to study sleep disorder in fibromyalgia, and provide new insight into the research of oscillographic biomarker. This article be protect by copyright. All right reserve","The pathogenesis of fibromyalgia is still unknown. Core symptoms include pain, depression and sleep disturbances with high comorbidity, suggesting alterations in the monoaminergic system as a common origin of this disease. The reserpine-induced myalgia model (RIM) lowers pain thresholds and produces depressive-like symptoms. The present work aims to evaluate temporal dynamics in the oscillatory profiles and motor activity during sleep in this model and to evaluate if the model mimics the sleep disorders that occur in fibromyalgia patients. Hippocampal and EMG activity were recorded in chronically implanted rats. Following 3?days of basal recordings, reserpine was administered on 3 consecutive days to achieve the RIM. Post-reserpine recordings were taken on alternate days for 21?days. Reserpine induced changes in the sleep architecture with more transitions between states, and a different pattern between the administration period and post-reserpine weeks. Administration days were characterized by a larger amount of REM sleep with dominant theta waves without atonia. Following the reserpinization, theta oscillations were always more fragmented and with lower frequency. On the post-reserpine days, sleep was dominated by slow-wave sleep with fast intrusions and reduced hierarchical coupling with spindles and ripples. Simultaneous electromyography recordings also showed muscle twitches during sleep and the dissociation of theta activity and muscle atonia. Abnormally high slow waves, alpha/delta intrusions, frequent transitions and muscle twitches are common traits in fibromyalgia. Therefore, our analyses support the validity of the reserpine-induced myalgia model to study sleep disorders in fibromyalgia, and provide new insights into the research of oscillographic biomarkers. This article is protected by copyright. All rights reserve","PubMed"
"Many pain condition in patient tend to co - occur, influence the clinical expression of each other in various way. This paper summarize the main concurrent pain condition by analyze the major interaction observe. In particular, co - occurrence will be examine in: visceral pain ( especially ischemic heart disease, irritable bowel syndrome, dysmenorrhea / endometriosis and urinary pain ), fibromyalgia, musculoskeletal pain and headache. Two concurrent visceral pain from internal organ share at less part of their central sensory projection can give rise to viscero - visceral hyperalgesia, i. e., enhancement of typical pain symptom from both district. Visceral pain, headache and musculoskeletal pain ( myofascial pain from trigger point, joint pain ) can enhance pain and hyperalgesia from fibromyalgia. Myofascial pain from trigger point can perpetuate pain symptom from visceral pain condition and trigger migraine attack when locate in the refer pain area from a internal organ or in cervico - facial area, respectively. The pathophysiology of this pain association be complex and probably multifactorial; among the possible process underlie the mutual influence of symptom record in the association be modulation of central sensitization phenomenon by nociceptive input from one or the other condition. A strong message in this pain syndrome co - occurrence be that effective treatment of one of the condition can also improve symptom from the other, thus suggest a systematic and thorough evaluation of the pain patient for a global effective management of his / her suffer. keyword: Fibromyalgia; Migraine; Myofascial pain syndrome; Pain co - occurrence; Tension - type headache; Visceral pain","Many pain conditions in patients tend to co-occur, influencing the clinical expressions of each other in various ways. This paper summarizes the main concurrent pain conditions by analyzing the major interactions observed. In particular, co-occurrence will be examined in: visceral pain (especially ischemic heart disease, irritable bowel syndrome, dysmenorrhea/endometriosis and urinary pain), fibromyalgia, musculoskeletal pain and headache. Two concurrent visceral pains from internal organs sharing at least part of their central sensory projection can give rise to viscero-visceral hyperalgesia, i.e., enhancement of typical pain symptoms from both districts. Visceral pain, headache and musculoskeletal pains (myofascial pain from trigger points, joint pain) can enhance pain and hyperalgesia from fibromyalgia. Myofascial pain from trigger points can perpetuate pain symptoms from visceral pain conditions and trigger migraine attacks when located in the referred pain area from an internal organ or in cervico-facial areas, respectively. The pathophysiology of these pain associations is complex and probably multifactorial; among the possible processes underlying the mutual influence of symptoms recorded in the associations is modulation of central sensitization phenomena by nociceptive inputs from one or the other condition. A strong message in these pain syndrome co-occurrence is that effective treatment of one of the conditions can also improve symptoms from the other, thus suggesting a systematic and thorough evaluation of the pain patient for a global effective management of his/her suffering.
KEYWORDS:

Fibromyalgia; Migraine; Myofascial pain syndrome; Pain co-occurrence; Tension-type headache; Visceral pain","PubMed"
"The available pharmacological modality for the treatment of fibromyalgia ( FM ) be associate with a variety of adverse effect and limit benefit. In this study, we systematically review the impact of melatonin in the treatment of FM. Interventional study, either control or uncontrolled and randomize or non - randomize, be include. PubMed, EMBASE, Scopus, Web of Science, and the Cochrane Library be search without time limitation. Primary outcome measure be the effect of melatonin on the disease impact, pain, sleep quality, tender point count, fatigue, anxiety, stiffness, and depression in FM patient. Four study, report the effect of melatonin on 98 patient, be eligible to include. All the study report the positive effect of melatonin on the FM symptom. No major adverse event be report. A significant level of heterogeneity be observe between the study. Therefore, far high - quality control clinical trial be need to understand the role of melatonin in FM treatment fully. Copyright? 2019 Elsevier Ltd. All right reserve. keyword: Fibromyalgia; Melatonin; Outcome; Treatment","The available pharmacological modalities for the treatment of fibromyalgia (FM) are associated with a variety of adverse effects and limited benefits. In this study, we systematically reviewed the impact of melatonin in the treatment of FM. Interventional studies, either controlled or uncontrolled and randomized or non-randomized, were included. PubMed, EMBASE, Scopus, Web of Science, and the Cochrane Library were searched without time limitation. Primary outcome measures were the effect of melatonin on the disease impact, pain, sleep quality, tender point count, fatigue, anxiety, stiffness, and depression in FM patients. Four studies, reporting the effect of melatonin on 98 patients, were eligible to include. All the studies reported the positive effect of melatonin on the FM symptoms. No major adverse event was reported. A significant level of heterogeneity was observed between the studies. Therefore, further high-quality controlled clinical trials are needed to understand the role of melatonin in FM treatment fully.

Copyright ? 2019 Elsevier Ltd. All rights reserved.
KEYWORDS:

Fibromyalgia; Melatonin; Outcome; Treatment","PubMed"
"Objective: The study be design to develop fibromyalgia assessment screen tool ( FAST ) index base only on multidimensional health assessment questionnaire ( MDHAQ ) score as clue to fibromyalgia ( FM ), analyze for possible agreement with the 2011 FM criterion. method: All patient with all diagnose complete a MDHAQ at each visit in routine care. The MDHAQ include score for physical function, pain, global assessment, fatigue, self - report painful joint count, and a 60 - symptom checklist. MDHAQ item similar or identical to the 2011 FM criterion symptom severity scale ( SSS ) and widespread pain index ( WPI ) component of a polysymptomatic distress scale ( PSD ) be compile into continuous MDHAQ - FM - SSS, MDHAQ - FM - WPI, and MDHAQ - FM - PSD index. Ten candidate MDHAQ score be analyze against the 2011 FM criterion use descriptive statistic, Spearman correlation, kappa statistic, and receiver operate characteristic curve for the area under the curve ( AUC ). MDHAQ candidate variable with the high AUC be compile into cumulative MDHAQ - FAST index of three ( FAST3 ) or four ( FAST4 ) score. result: The high AUCs among MDHAQ score be see for symptom checklist, painful joint count, fatigue, and pain, which be include in FAST4; FAST3 - F exclude pain, and FAST3 - P exclude fatigue. AUCs for FAST3 - P, FAST3 - F, and FAST4, as good as continuous MDHAQ - FM score, all be great than 0. 92, indicate excellent criterion validity. Kappa statistic versus the 2011 criterion be 0. 63 - 0. 68, high than 0. 41 - 0. 47 versus physician ICD - 10 diagnose. Conclusion: Pragmatic FAST3, FAST4, and MDHAQ - FM index be similar to FM criterion to screen for FM in routine care. It be much feasible to collect the same MDHAQ, which be informative in all rheumatic disease study, from each patient than to ask different patient with different diagnose to complete different questionnaire.","Objective:

The study was designed to develop fibromyalgia assessment screening tool (FAST) indices based only on multidimensional health assessment questionnaire (MDHAQ) scores as clues to fibromyalgia (FM), analyzed for possible agreement with the 2011 FM criteria.
Methods:

All patients with all diagnoses complete an MDHAQ at each visit in routine care. The MDHAQ includes scores for physical function, pain, global assessment, fatigue, self-report painful joint count, and a 60-symptom checklist. MDHAQ items similar or identical to the 2011 FM criteria symptom severity scale (SSS) and widespread pain index (WPI) components of a polysymptomatic distress scale (PSD) were compiled into continuous MDHAQ-FM-SSS, MDHAQ-FM-WPI, and MDHAQ-FM-PSD indices. Ten candidate MDHAQ scores were analyzed against the 2011 FM criteria using descriptive statistics, Spearman correlations, kappa statistics, and receiver operating characteristic curves for the area under the curve (AUC). MDHAQ candidate variables with the highest AUC were compiled into cumulative MDHAQ-FAST indices of three (FAST3) or four (FAST4) scores.
Results:

The highest AUCs among MDHAQ scores were seen for symptom checklist, painful joint count, fatigue, and pain, which are included in FAST4; FAST3-F excludes pain, and FAST3-P excludes fatigue. AUCs for FAST3-P, FAST3-F, and FAST4, as well as continuous MDHAQ-FM scores, all were greater than 0.92, indicating excellent criterion validity. Kappa statistics versus the 2011 criteria were 0.63-0.68, higher than 0.41-0.47 versus physician ICD-10 diagnoses.
Conclusion:

Pragmatic FAST3, FAST4, and MDHAQ-FM indices are similar to FM criteria to screen for FM in routine care. It is more feasible to collect the same MDHAQ, which is informative in all rheumatic diseases studied, from each patient than to ask different patients with different diagnoses to complete different questionnaires.","PubMed"
