"lemmatizedAbstract","abstract","source"
"To compare the efficacy of intermittent and consecutive balneological outpatient treatment ( hydrotherapy and peloidotherapy ) in fibromyalgia syndrome ( FMS ). A parallel 1: 1, single - blind, pilot study be perform. patient be recruit from musculoskeletal disorder outpatient clinic. Eligible participant be patient age 18 - 60, diagnose as FMS accord to ACR 2010 criterion. They be randomly assign to either consecutive or intermittent treatment group. Both group receive 20 min of full body immersion in a tap water pool at 38 - 39 øC and 30 min of mud pack application on the back region at 45 øC. Delivery of the treatment be five time weekly during 2 week in consecutive group and two time weekly during 5 week in intermittent group. The primary outcome be pain intensity and the numb of patient achieve a minimal clinically important difference ( MCID ) on Fibromyalgia Impact Questionnaire ( FIQ ) at the 1st month after the completion of the treatment. Statistical analysis be base on intention to treat method. The assess physician be blind. Pain intensity significantly decrease in all post - treatment evaluation of both group ( except after treatment in the intermittent group ). There be no significant difference between the group. MCID for FIQ be achieve in 6 ( 24 % ) patient in the consecutive group and 12 ( 48 % ) in the intermittent group at the 1st month. There be no statistical difference in the secondary judgment criterion. The consecutive and intermittent delivery of balneological outpatient treatment ( hydrotherapy and peloidotherapy ) seem to have similar effect on the clinical status of patient with FMS. keyword: Balneotherapy; Fibromyalgia syndrome; Hydrotherapy; Intermittent balneotherapy; Peloidotherapy","To compare the efficacy of intermittent and consecutive balneological outpatient treatment (hydrotherapy and peloidotherapy) in fibromyalgia syndrome (FMS). A parallel 1:1, single-blind, pilot study was performed. Patients were recruited from musculoskeletal disorders outpatient clinic. Eligible participants were patients aged 18-60, diagnosed as FMS according to ACR 2010 criteria. They were randomly assigned to either consecutive or intermittent treatment groups. Both groups received 20 min of full body immersion in a tap water pool at 38-39 øC and 30 min of mud pack application on the back region at 45 øC. Delivery of the treatment was five times weekly during 2 weeks in consecutive group and two times weekly during 5 weeks in intermittent group. The primary outcomes were pain intensity and the number of patients achieving a minimal clinically important difference (MCID) on Fibromyalgia Impact Questionnaire (FIQ) at the 1st month after the completion of the treatment. Statistical analyses were based on intention to treat method. The assessing physician was blinded. Pain intensity significantly decreased in all post-treatment evaluations of both groups (except after treatment in the intermittent group). There was no significant difference between the groups. MCID for FIQ was achieved in 6 (24%) patients in the consecutive group and 12 (48%) in the intermittent group at the 1st month. There was no statistical difference in the secondary judgment criteria. The consecutive and intermittent deliveries of balneological outpatient treatment (hydrotherapy and peloidotherapy) seem to have similar effects on the clinical status of patients with FMS.
KEYWORDS:

Balneotherapy; Fibromyalgia syndrome; Hydrotherapy; Intermittent balneotherapy; Peloidotherapy","PubMed"
"The objective of the present study be to experimentally assess the effect of a mindfulness - base intervention ( MBI ) for the improvement of subjective good - be, trait emotional intelligence ( TEI ), mental health, and resilience in a sample of woman with fibromyalgia ( FM ). The sample consist of 104 woman, between 29 and 77 year old ( be = 47. 59; SD = 5. 93 ). The measure use be as follow: Satisfaction with Life Scale ( SWLS ), Positive and Negative Affection Scale ( PANAS ), Trait Emotional Intelligence Questionnaire Short Form ( TEIQue - SF ), Mental Health Questionnaire ( MH - 5 ), and Resilience Scale ( ER - 14 ). A quasi - experimental design of repeat measure with a control group ( CG ) be use: before and after the application of the treatment and a follow - up assessment 6 month after the completion of the intervention. In order to assess the effect of the program, the participant be randomly assign to the experimental and control condition. In the pretest evaluation, a multivariate analysis of variance ( MANOVA ) and analysis of variance ( ANOVA ) be carry out. In the post - test evaluation, a multivariate analysis of covariance ( MANCOVA ) of the study variable as a whole be perform. Then, descriptive analysis and analysis of covariance ( ANCOVA ) of the post - test score ( covariate pretest score ) be perform. In the follow - up evaluation, a MANCOVA of the study variable as a whole be perform. Then, descriptive and ANCOVA analysis of the follow - up score ( covariate pretest score ) be perform. In addition, the effect size be calculate use partial eta - square (? 2 ). The post - test result confirm statistically significant difference in satisfaction with life ( SWL ), positive affect ( PA ), mental health, and resilience. The follow - up result show statistically significant difference in SWL, PA, TEI, mental health, and resilience. The study provide a effective intervention tool that have be validate experimentally. The general result allow the emphasis of the importance of the implementation of MBIs frame in non - pharmacological treatment in FM. Copyright? 2019 Cejudo, Garc ¡ a - Castillo, Luna, Rodrigo - Ruiz, Feltrero and Moreno - G¢mez. keyword: chronic pain; fibromyalgia; mindfulness; random assignment; subjective good - be","The objective of the present study was to experimentally assess the effects of a mindfulness-based intervention (MBI) for the improvement of subjective well-being, trait emotional intelligence (TEI), mental health, and resilience in a sample of women with fibromyalgia (FM). The sample consisted of 104 women, between 29 and 77 years old (M = 47.59; SD = 5.93). The measures used were as follows: Satisfaction with Life Scale (SWLS), Positive and Negative Affection Scale (PANAS), Trait Emotional Intelligence Questionnaire Short Form (TEIQue-SF), Mental Health Questionnaire (MH-5), and Resilience Scale (ER-14). A quasi-experimental design of repeated measures with a control group (CG) was used: before and after the application of the treatment and a follow-up assessment 6 months after the completion of the intervention. In order to assess the effect of the program, the participants were randomly assigned to the experimental and control conditions. In the pretest evaluation, a multivariate analysis of variance (MANOVA) and analysis of variance (ANOVA) were carried out. In the post-test evaluation, a multivariate analysis of covariance (MANCOVA) of the study variables as a whole was performed. Then, descriptive analyses and analysis of covariance (ANCOVA) of the post-test scores (covariate pretest score) were performed. In the follow-up evaluation, a MANCOVA of the study variables as a whole was performed. Then, descriptive and ANCOVA analyses of the follow-up scores (covariate pretest score) were performed. In addition, the effect size was calculated using partial eta-squared (?2). The post-test results confirmed statistically significant differences in satisfaction with life (SWL), positive affect (PA), mental health, and resilience. The follow-up results showed statistically significant differences in SWL, PA, TEI, mental health, and resilience. The study provides an effective intervention tool that has been validated experimentally. The general results allow the emphasis of the importance of the implementation of MBIs framed in non-pharmacological treatments in FM.

Copyright ? 2019 Cejudo, Garc¡a-Castillo, Luna, Rodrigo-Ruiz, Feltrero and Moreno-G¢mez.
KEYWORDS:

chronic pain; fibromyalgia; mindfulness; random assignment; subjective well-being","PubMed"
"BACKGROUND: Fibromyalgia be a heterogeneous condition that appear to be associate with physiological and biochemical disturbance of pain modulation, and that consequently affect numerous other facet of life. Tramadol be currently be explore as a option to manage fibromyalgia pain and other symptom because of its inhibitory activity of reuptake of neurotransmitter, but its safety and efficacy have not yet be establish in this patient. OBJECTIVE: To evaluate the effectiveness and safety of tramadol on the management of symptom of the syndrome. method: We search CENTRAL, MEDLINE, EMBASE, lilac, Opengrey, ClinicalTrials. gov, and WHO - ICTRP for randomize control trial analyze the association between tramadol use for fibromyalgia either single - agent or in combination with other drug. Two reviewer independently extract datum and assess risk of bias use the Cochrane risk - of - bias tool for all include study. Quality of the evidence be evaluate use the grade of recommendation Assessment, Development and Evaluation ( GRADE ). result: Four RCTs comprise 459 patient be include. Tramadol - either as a single - agent or in combination with a antidepressant or analgesic - have a positive effect on pain. Tramadol combine with analgesic show improve quality of life over placebo as measure by the Fibromyalgia Impact Questionnaire at 91 day. However, this difference do not hold for tramadol as a single agent against placebo. The evidence in this article be rate "" low "" use the GRADE approach. No serious adverse event be report. No improvement in depression and quality of sleep be observe. conclusion: This systematic review find a dearth of clinical trial on tramadol in patient with fibromyalgia. Although the combination of monoamine and opioid mechanism of tramadol have show positive effect for fibromyalgia, the available evidence be not sufficient to support or refute the use of tramadol in clinical practice for pain or symptom management.","BACKGROUND:

Fibromyalgia is a heterogeneous condition that appears to be associated with physiological and biochemical disturbances of pain modulation, and that consequently affects numerous other facets of life. Tramadol is currently being explored as an option to manage fibromyalgia pain and other symptoms because of its inhibitory activity of reuptake of neurotransmitters, but its safety and efficacy have not yet been established in these patients.
OBJECTIVE:

To evaluate the effectiveness and safety of tramadol on the management of symptoms of the syndrome.
METHODS:

We searched CENTRAL, MEDLINE, EMBASE, LILACS, Opengrey, ClinicalTrials. gov, and WHO-ICTRP for randomized controlled trials analyzing the association between tramadol used for fibromyalgia either single-agent or in combination with other drugs. Two reviewers independently extracted data and assessed risk of bias using the Cochrane risk-of-bias tool for all included studies. Quality of the evidence was evaluated using the Grading of Recommendations Assessment, Development and Evaluation (GRADE).
RESULTS:

Four RCTs comprising 459 patients were included. Tramadol-either as a single-agent or in combination with an antidepressant or analgesic-had a positive effect on pain. Tramadol combined with analgesic showed improved quality of life over placebo as measured by the Fibromyalgia Impact Questionnaire at 91 days. However, this difference did not hold for tramadol as a single agent against placebo. The evidence in these articles was rated ""low"" using the GRADE approach. No serious adverse events were reported. No improvement in depression and quality of sleep were observed.
CONCLUSIONS:

This systematic review found a dearth of clinical trials on tramadol in patients with fibromyalgia. Although the combination of monoamine and opioid mechanism of tramadol has shown positive effects for fibromyalgia, the available evidence is not sufficient to support or refute the use of tramadol in clinical practice for pain or symptom management.","PubMed"
"Background: Fibromyalgia ( FM ) be a chronic widespread pain disorder characterize by negative affect, sleep disturbance, and fatigue. This uncontrolled pilot study investigate the efficacy of daily yoga - base exercise to improve FM symptom and explore baseline phenotypic characteristic associate with the great benefit. method: FM patient ( n=46, with 36 completer ) report psychosocial function and a range of FM symptom use validate instrument before and after participation in Satyananda yoga, which include weekly in - person pain - tailor group class for 6 week and daily home yoga video practice. result: change in FM symptom from pre - to post - yoga be variable amongst participant. Group mean for pain decrease, as report by average daily diary and Brief Pain Inventory, with great home practice minute associate with a great decrease in pain. Average daily rating of sleep and fatigue improve. Pain catastrophizing be decrease overall, with great change correlate to a decrease in FM symptom. We do not observe any group mean change in actigraphy sleep efficiency, Patient - report outcome Measurement Information System - anxiety and the revise Fibromyalgia Impact Questionnaire. Multilevel model analysis reveal a significant interaction between anxiety and catastrophizing for end - study sleep efficiency, fatigue, and pain, such that patient with high baseline catastrophizing and low baseline anxiety report little pain and fatigue, and high sleep efficiency after the 6 week of yoga practice. Conclusion: This pilot study suggest that yoga may reduce pain and catastrophizing, as good as improve sleep, but this change be modest across study participant. great uptake of home yoga practice as good as a phenotype of high baseline catastrophizing combine with low baseline anxiety be associate with great impact. Future randomize, control trial compare different type of yoga or exercise will allow determination of the much effective treatment for FM and allow close target to the patient who will benefit much from them.","Background:

Fibromyalgia (FM) is a chronic widespread pain disorder characterized by negative affect, sleep disturbance, and fatigue. This uncontrolled pilot study investigated the efficacy of daily yoga-based exercise to improve FM symptoms and explored baseline phenotypic characteristics associated with the greatest benefit.
Methods:

FM patients (n=46, with 36 completers) reported psychosocial functioning and a range of FM symptoms using validated instruments before and after participation in Satyananda yoga, which included weekly in-person pain-tailored group classes for 6 weeks and daily home yoga video practice.
Results:

Changes in FM symptoms from pre- to post-yoga were variable amongst participants. Group means for pain decreased, as reported by average daily diary and Brief Pain Inventory, with greater home practice minutes associated with a greater decrease in pain. Average daily ratings of sleep and fatigue improved. Pain catastrophizing was decreased overall, with greater change correlated to a decrease in FM symptoms. We did not observe any group mean changes in actigraphy sleep efficiency, Patient-Reported Outcomes Measurement Information System-anxiety and the Revised Fibromyalgia Impact Questionnaire. Multilevel Modeling analysis revealed a significant interaction between anxiety and catastrophizing for end-study sleep efficiency, fatigue, and pain, such that patients with higher baseline catastrophizing and lower baseline anxiety reported less pain and fatigue, and higher sleep efficiency after the sixth week of yoga practice.
Conclusion:

This pilot study suggests that yoga may reduce pain and catastrophizing, as well as improve sleep, but these changes were modest across study participants. Greater uptake of home yoga practice as well as a phenotype of higher baseline catastrophizing combined with lower baseline anxiety were associated with greater impact. Future randomized, controlled trials comparing different types of yoga or exercise will allow determination of the most effective treatments for FM and allow closer targeting to the patients who will benefit most from them.","PubMed"
"objective: To determine the psychopathological profile of patient with central sensitization ( c ) in a sample of knee osteoarthritis, with and without c, and fibromyalgia, and to compare their psychopathological profile. method: The final sample consist of 19 patient with osteoarthritis and c ( mean 66.37 year ñ 8. 77 ), 41 osteoarthritis patient without c ( mean 66.8 ñ 7.39 year ), 47 fibromyalgia patient ( mean 46.47 year ñ 7. 92 ) and 26 control subject ( mean 51.56 year ñ 11. 41 ). The psychopathological profile be evaluate with the Millon Multiaxial Clinical Inventory. result: The average score of MCMI - III reflect high score in the fibromyalgia and osteoarthritis - c group. patient with osteoarthritis - c be much likely to report large score in Borderline and Major Depression scale. Fibromyalgia patient be much likely to report much increase score in Somatoform and Major Depression, versus osteoarthritis - c group. Fibromyalgia patient versus osteoarthritis without c be much likely to report high score in Schizoid, Depression, Histrionic, Sadistic, Borderline, Somatoform, Posttraumatic Stress Disorder and Major Depression scale. DISCUSSION: patient with c have little difference in their psychopathological profile as good as in both osteoarthritis group and great difference be obtain between the fibromyalgia and osteoarthritis without c, so perhaps presence of c be the key to differentiate that group and not chronic pain. a exhaustive assessment bring much accurate psychopathological profile, thus good psychological treatment can be apply.","OBJECTIVES:

To determine the psychopathological profile of patients with central sensitization (CS) in a sample of knee osteoarthritis, with and without CS, and fibromyalgia, and to compare their psychopathological profiles.
METHODS:

The final sample consists of 19 patients with osteoarthritis and CS (mean 66.37 years ñ 8.77), 41 osteoarthritis patients without CS (mean 66.8 ñ 7.39 years), 47 fibromyalgia patients (mean 46.47 years ñ 7.92) and 26 control subjects (mean 51.56 years ñ 11.41). The psychopathological profile was evaluated with the Millon Multiaxial Clinical Inventory.
RESULTS:

The average score of MCMI-III reflect higher scores in the fibromyalgia and osteoarthritis-CS groups. Patients with osteoarthritis-CS are more likely to report larger scores in Borderline and Major Depression scales. Fibromyalgia patients are more likely to report more increased scores in Somatoform and Major Depression, versus osteoarthritis-CS group. Fibromyalgia patients versus osteoarthritis without CS are more likely to report higher scores in Schizoid, Depression, Histrionic, Sadistic, Borderline, Somatoform, Posttraumatic Stress Disorder and Major Depression scales.
DISCUSSION:

Patients with CS have less differences in their psychopathological profiles as well as in both osteoarthritis groups and greatest differences are obtained between the fibromyalgia and osteoarthritis without CS, so perhaps presence of CS is the key to differentiate those groups and not chronic pain. An exhaustive assessment brings more accurate psychopathological profiles, thus better psychological treatment could be applied.","PubMed"
"Intimate partner violence ( IPV ) be a global public health issue with a variety of ill health consequence associate with exposure. Due to the stimulation of chronic stress and inflammatory pathway, childhood abuse have be associate with the subsequent development of functional syndrome such as fibromyalgia and chronic fatigue syndrome ( CFS ). Although IPV in woman appear to elicit similar biochemical response, this association have not be test thoroughly in IPV survivor. this functional syndrome be complex in etiology and any indication of their risk factor would benefit health care professional manage this population. Therefore, we aim to investigate the association between exposure to IPV with functional syndrome: fibromyalgia and CFS. We conduct a retrospective open cohort study use "" The Heath Improvement Network "" database between January 1, 1995 and December 1, 2017. A total of 18,547 woman who be expose to IPV be each match by age to four control who be not expose ( n = 74,188 ). The main outcome measure be the risk of develop fibromyalgia and CFS. this be present as adjust incidence rate ratio ( aIRR ) with 95 % confidence interval ( CIs ). We find that 97 woman in the expose group develop fibromyalgia ( incidence rate [ IR ] = 1.63 per 1,000 person - year ) compare to 239 woman in the unexposed group ( IR = 0.83 per 1,000 person - year ). follow adjustment, this translate to a IRR of 1.73 ( 95 % CI = [ 1. 36, 2. 22 ] ). Similarly, 19 woman develop CFS in the expose group ( IR = 0.32 per 1,000 person - year ), compare to 53 in the unexposed group ( 0. 18 per 1,000 person - year ), which translate to a aIRR of 1.92 ( 95 % CI = [ 1. 11, 3. 33 ] ). Therefore, we have identify a association between a history of IPV in woman and the development of this functional syndrome, which may provide much information to inform the biopsychosocial pathway precipitate the development of fibromyalgia and CFS.","Intimate partner violence (IPV) is a global public health issue with a variety of ill health consequences associated with exposure. Due to the stimulation of chronic stress and inflammatory pathways, childhood abuse has been associated with the subsequent development of functional syndromes such as fibromyalgia and chronic fatigue syndrome (CFS). Although IPV in women appears to elicit similar biochemical responses, this association has not been tested thoroughly in IPV survivors. These functional syndromes are complex in etiology and any indication of their risk factors would benefit health care professionals managing this population. Therefore, we aimed to investigate the association between exposure to IPV with functional syndromes: fibromyalgia and CFS. We conducted a retrospective open cohort study using ""The Heath Improvement Network"" database between January 1, 1995 and December 1, 2017. A total of 18,547 women who were exposed to IPV were each matched by age to four controls who were not exposed (n = 74,188). The main outcome measures were the risk of developing fibromyalgia and CFS. These were presented as adjusted incidence rate ratios (aIRR) with 95% confidence intervals (CIs). We found that 97 women in the exposed group developed fibromyalgia (incidence rate [IR] = 1.63 per 1,000 person-years) compared to 239 women in the unexposed group (IR = 0.83 per 1,000 person-years). Following adjustment, this translated to an IRR of 1.73 (95% CI = [1.36, 2.22]). Similarly, 19 women developed CFS in the exposed group (IR = 0.32 per 1,000 person-years), compared to 53 in the unexposed group (0.18 per 1,000 person-years), which translates to an aIRR of 1.92 (95% CI = [1.11, 3.33]). Therefore, we have identified an association between a history of IPV in women and the development of these functional syndromes, which may provide more information to inform the biopsychosocial pathway precipitating the development of fibromyalgia and CFS.","PubMed"
